{
  "meta": {
    "agent": "solution_architect",
    "version": "0.1.0",
    "request_id": "REQ-2026-0142",
    "generated_at": "2026-07-06T00:00:00Z",
    "overall_confidence": "medium"
  },
  "request_summary": "The Growth team needs measurement of the new online money-transfer signup-to-first-transfer flow to identify drop-off, and a weekly dashboard for leadership. Funnel conversion is currently unmeasured and GA4 is only partially configured.",
  "objective": "Measure conversion and drop-off across the signup-to-first-transfer funnel and deliver a weekly leadership dashboard of those rates by the end of the current quarter.",
  "request_type": "digital_analytics_tracking",
  "business_context": "A redesigned signup-to-first-transfer flow launched last quarter; leadership suspects high drop-off but has no measurement to confirm or locate it.",
  "stakeholders": [
    { "name_or_role": "Head of Growth", "responsibility": "Business sponsor; consumes weekly dashboard", "is_owner": true, "state": "confirmed" },
    { "name_or_role": "Digital Analytics Specialist", "responsibility": "Owns event taxonomy and GA4 implementation", "is_owner": true, "state": "assumed" },
    { "name_or_role": "Data/Technical owner of signup web app", "responsibility": "Enables event instrumentation in the app", "is_owner": true, "state": "unknown" }
  ],
  "solution_options": [
    {
      "name": "GA4 event funnel + BI dashboard",
      "summary": "Define a standard event taxonomy for the funnel steps, implement/complete GA4 tracking, and build a weekly leadership dashboard in the BI tool on top of GA4 (or its warehouse export).",
      "pros": ["Reuses existing GA4 investment", "Standard funnel/attribution tooling", "Fastest path to a leadership dashboard"],
      "cons": ["Depends on completing GA4 instrumentation in the app", "PII handling must be validated in GA4 configuration"],
      "rough_effort": "medium"
    },
    {
      "name": "Warehouse-based funnel from app events",
      "summary": "Stream raw app events into the warehouse, model the funnel there, and serve the dashboard from modeled tables.",
      "pros": ["Full control over funnel definition and history", "Avoids GA4 sampling/PII constraints"],
      "cons": ["Higher effort; needs a pipeline and data model", "Unlikely to meet the end-of-quarter target"],
      "rough_effort": "high"
    }
  ],
  "recommended_option": {
    "option_name": "GA4 event funnel + BI dashboard",
    "rationale": "GA4 is already partially in place and the outcome required is a weekly leadership funnel view within the quarter. Completing GA4 instrumentation and layering a BI dashboard is the lowest-effort path that meets the deadline. The warehouse option is stronger long-term but does not fit the timeframe and can be a phase 2."
  },
  "solution_components": [
    { "type": "data_source", "name": "Signup web app events", "description": "User interaction events across funnel steps (landing, signup start, verification, first transfer).", "state": "unknown" },
    { "type": "analytics_layer", "name": "GA4 property", "description": "Event collection, funnel and attribution analysis; needs taxonomy completion.", "state": "assumed" },
    { "type": "integration", "name": "GA4 → BI/warehouse export", "description": "Path to feed the BI dashboard (native connector or BigQuery export).", "state": "unknown" },
    { "type": "visualization", "name": "Weekly leadership funnel dashboard", "description": "Funnel conversion and step-level drop-off, refreshed weekly.", "state": "confirmed" },
    { "type": "governance", "name": "PII handling in analytics", "description": "Ensure no restricted PII is captured in GA4/event layer; classify funnel data.", "state": "unknown" }
  ],
  "success_metrics": [
    { "metric": "Landing-to-first-transfer conversion rate is measured and reported", "target": "Reported weekly", "measurable": true },
    { "metric": "Step-level drop-off identified for each funnel stage", "measurable": true },
    { "metric": "Leadership dashboard adopted (weekly views by sponsor)", "measurable": false }
  ],
  "risks": [
    { "category": "unclear_data_source", "description": "It is unknown whether the signup app currently emits the events needed for each funnel step.", "severity": "high", "likelihood": "high", "mitigation": "Audit current GA4/app instrumentation before committing to the timeline.", "owner": "Digital Analytics Specialist", "is_gap": false },
    { "category": "security_compliance", "description": "The flow handles customer PII; capturing it in GA4/event layer could breach policy.", "severity": "high", "likelihood": "medium", "mitigation": "Governance review of what is captured; enforce no restricted PII in analytics events.", "owner": "Data Governance Specialist", "is_gap": false },
    { "category": "missing_ownership", "description": "No confirmed technical owner for instrumenting events in the signup web app.", "severity": "medium", "likelihood": "high", "is_gap": true },
    { "category": "unclear_success_metric", "description": "Dashboard-adoption success is not currently measurable.", "severity": "low", "likelihood": "medium", "is_gap": true }
  ],
  "open_questions": [
    { "question": "Which funnel-step events does the signup app already emit, and via what mechanism?", "directed_to": "Signup web app team", "priority": "high" },
    { "question": "What is the sanctioned path from GA4 to the BI tool (native connector vs BigQuery export)?", "directed_to": "Digital Analytics Specialist", "priority": "medium" },
    { "question": "What customer data is allowed in the analytics layer under current PII policy?", "directed_to": "Data Governance Specialist", "priority": "high" }
  ],
  "assumptions": [
    { "assumption": "GA4 is the sanctioned digital analytics platform for this flow.", "impact_if_wrong": "Option and effort estimates change; may require a warehouse-based approach." },
    { "assumption": "A BI tool is available to serve the weekly dashboard.", "impact_if_wrong": "Adds tooling selection/procurement to scope and timeline." }
  ],
  "delivery_dependencies": [
    { "dependency": "Signup app must emit the required funnel-step events", "depends_on_role": "data_engineering", "blocking": true },
    { "dependency": "GA4 event taxonomy defined and implemented", "depends_on_role": "digital_analytics", "blocking": true },
    { "dependency": "PII/governance sign-off on captured data", "depends_on_role": "data_governance", "blocking": true },
    { "dependency": "Dashboard build once data flows", "depends_on_role": "data_visualization", "blocking": false }
  ],
  "handoffs": [
    {
      "to_role": "digital_analytics",
      "objective": "Define and implement the GA4 event taxonomy for the signup-to-first-transfer funnel and validate tracking.",
      "scope": ["Define funnel-step events (landing, signup start, verification, first transfer)", "Complete/repair GA4 instrumentation", "Set up GA4 funnel + attribution", "QA that events fire correctly"],
      "inputs_provided": ["Funnel definition (4 stages)", "Constraint: no restricted PII in events", "Sponsor: Head of Growth"],
      "open_items": ["Confirm which events the app already emits", "Confirm GA4 → BI export path"]
    },
    {
      "to_role": "data_governance",
      "objective": "Ensure the analytics implementation complies with PII policy and classify the funnel data.",
      "scope": ["Review what customer data would be captured in GA4/event layer", "Confirm allowed fields", "Classify funnel dataset"],
      "inputs_provided": ["Flow handles customer PII", "Analytics platform: GA4 (assumed)"],
      "open_items": ["Current PII policy specifics for analytics layer"]
    },
    {
      "to_role": "data_visualization",
      "objective": "Build the weekly leadership funnel dashboard once measured funnel data is available.",
      "scope": ["Design funnel conversion + step drop-off view", "Weekly refresh", "Leadership-appropriate summary"],
      "inputs_provided": ["Audience: leadership, weekly cadence", "Metrics: conversion rate + step-level drop-off"],
      "open_items": ["Data source finalized (GA4 vs warehouse export)", "BI tool confirmed"]
    },
    {
      "to_role": "project_management",
      "objective": "Coordinate the end-of-quarter delivery across analytics, governance, and visualization.",
      "scope": ["Sequence blocking dependencies", "Track the instrumentation-owner gap to resolution", "Status to sponsor"],
      "inputs_provided": ["Delivery dependencies list", "Risk register", "Target: end of current quarter"],
      "open_items": ["Assign technical owner for app instrumentation"]
    }
  ]
}
